{"authority":{"classification":"RESEARCH_ONLY","clinical_authorization":false,"experiment_authorization":false,"merge_authorization":false,"model_fitting_authorized":false,"preregistration_gate_passed":false},"cohort":{"missing_response_sample_ids":[],"missing_selected_sample_ids":[],"response_complete_records":17,"selected_records":17,"selected_sample_ids":["sample372","sample378","sample386","sample404","sample405","sample416","sample421","sample441","sample452","sample454","sample459","sample466","sample468","sample486","sample498","sample499","sample505"],"selection_uses_response_label":false},"dataset":{"adapter":"live-seq-gse141064","id":"GSE141064","version":"pinned-public-inputs-v0.1"},"inputs":{"matrix":{"path":"GSE141064_count.final.csv.gz","sample_identifiers":1012,"sha256":"sha256:0e8a07d36a4b06bc8ced881bf97114adc2b55681b5ccf00d29e4f80e05107b22"},"metadata":{"identifiers":1012,"path":"meta.final.csv","sha256":"sha256:dcce9bea9444857a6a042fc64be3a5c7b31a00095a21eabc1488e516abd689c8"},"reuse_status":"unclear"},"integrity":{"errors":[],"full_id_sets_match":true,"matrix_ids_unique":true,"metadata_ids_unique":true,"selected_ids_unique":true},"limitations":["Readiness checks validate data and evidence contracts, not biological truth.","No model is fitted and no biological effect is estimated.","No causal, safety, therapeutic, clinical, or experiment-authorization claim is produced."],"next_action":"Obtain source-backed experimental-unit semantics before preregistration.","replicates":{"cross_group_repeated_identity_ids":[],"effective_independent_units":0,"independent_units":[],"minimum_independent_units":2,"repeated_identity_groups":{},"semantics":"unresolved"},"schema":"kairos.dataset-readiness-result.v0.1","status":"BLOCKED_REPLICATE_SEMANTICS_UNRESOLVED"}
